Id,DietitianId,Name,Description,IsPublic,IsDemo,IsDraft,IsHiddenFromProduction,StepsJson,ArchivedAtUtc,CookTimeMinutes,IsArchived,PrepTimeMinutes,Servings,TagsJson,Slug,CaloriesKcal,CarbsGrams,FatGrams,ProteinGrams
78aa1d1a-44f4-5f39-b4bc-67ba6add8740,dcdcbd23-7726-4f45-a0df-ddcd5a3b098c,Yoğurt soslu tavuklu sandviç,"Ofis temposuna uygun bu sandviç, dışarıda yemek gereken günlerde planı korumayı kolaylaştırır. Çavdar Ekmeği tabanı ve dengeli iç harcı sayesinde hızlı ama doyurucu bir seçenek sunar.",True,False,False,False,"[""Çavdar Ekmeği dilimlerini hafifçe ısıtın."", ""Yüzeye önce yoğurt sos, ardından tavuk göğsü katmanını ekleyin."", ""Renkli Biber ile taze bir katman oluşturun."", ""Sandviçi sıkı şekilde kapatıp ikiye bölün."", ""İsteğe göre yanında ayran veya salata ile servis edin.""]",NULL,8,False,12,1,"[""öğle yemeği"", ""sandviç"", ""ofis dostu"", ""yüksek protein"", ""taşınabilir""]",yogurt-soslu-tavuklu-sandvic-78aa1d,390,34.00,11.30,38.00
caacf948-6d9e-515a-9052-ba8dbe6e1bf9,dcdcbd23-7726-4f45-a0df-ddcd5a3b098c,Naneli mandalinalı chia tohumu ve süzme yoğurt kasesi,"Akdeniz esintili bu kahvaltı, lif ve sağlıklı yağ dengesi için tasarlandı. Mandalina, chia tohumu ve süzme yoğurt birleşimiyle hafif ama dengeli bir başlangıç sunar.",True,False,False,False,"[""Chia Tohumu tabanını uygun bir kapta hazırlayın; gerekiyorsa birkaç dakika önceden sıvı ile yumuşatın."", ""Süzme Yoğurt ile mandalina parçalarını ayrı bir kapta nazikçe karıştırın."", ""Kaseye önce chia tohumu tabanını, üzerine süzme yoğurt karışımını alın."", ""Keten Tohumu ve seçtiğiniz baharat dokunuşunu üzerine serpin."", ""Kıvamı oturduktan sonra soğuk servis edin.""]",NULL,4,False,14,1,"[""kahvaltı"", ""kase"", ""akdeniz"", ""omega-3"", ""fermente"", ""c vitamini""]",naneli-mandalinali-chia-tohumu-ve-suzme-yogurt-kasesi-caacf9,437,36.00,22.30,23.00
1e62ca71-93e6-51c0-a38a-1b526be31c87,dcdcbd23-7726-4f45-a0df-ddcd5a3b098c,Tarçınlı çilekli kinoa ve süzme yoğurt kasesi,"Yüksek protein odaklı bu kahvaltı, kas korunumu ve uzun süreli tokluk için tasarlandı. Çilek, kinoa ve süzme yoğurt birleşimiyle hafif ama dengeli bir başlangıç sunar.",True,False,False,False,"[""Kinoa tabanını uygun bir kapta hazırlayın; gerekiyorsa birkaç dakika önceden sıvı ile yumuşatın."", ""Süzme Yoğurt ile çilek parçalarını ayrı bir kapta nazikçe karıştırın."", ""Kaseye önce kinoa tabanını, üzerine süzme yoğurt karışımını alın."", ""Keten Tohumu ve seçtiğiniz baharat dokunuşunu üzerine serpin."", ""Kıvamı oturduktan sonra soğuk servis edin.""]",NULL,1,False,7,1,"[""kahvaltı"", ""kase"", ""yüksek protein"", ""kompleks karbonhidrat"", ""fermente"", ""meyveli""]",tarcinli-cilekli-kinoa-ve-suzme-yogurt-kasesi-1e62ca,444,48.00,17.30,24.00
3ac14b32-6f38-5ff0-9321-10313e7630c9,dcdcbd23-7726-4f45-a0df-ddcd5a3b098c,Naneli bezelyeli ve karnabaharlı omlet,"Hızlı hazırlanabilen dokulu bu tarif, yumurta ve sebzeleri tek tavada bir araya getirir. Günün ilk yarısında dengeli bir protein kaynağı arayanlar için uygundur.",True,False,False,False,"[""Bezelye ve karnabahar küçük parçalar halinde doğrayın."", ""Yapışmaz tavayı ısıtıp sebzeleri kısa süre soteleyin."", ""Yumurtaları çırpıp lor peyniri ile pürüzsüz hale getirin."", ""Karışımı tavaya dökün ve kısık ateşte kontrollü şekilde pişirin."", ""Omleti ikiye katlayıp sıcak servis edin.""]",NULL,9,False,12,1,"[""kahvaltı"", ""omlet"", ""pratik"", ""tava"", ""lif"", ""yüksek protein""]",naneli-bezelyeli-ve-karnabaharli-omlet-3ac14b,516,26.00,25.80,45.00
255d7059-73f6-550d-bf53-3838f4f801dc,dcdcbd23-7726-4f45-a0df-ddcd5a3b098c,Çilekli şeftalili ve ıspanaklı smoothie,"Sebze ağırlıklı ara öğün alternatifi olan bu smoothie, mikrobesin çeşitliliği ve sindirim konforu hedefini destekler. Meyve ve yeşil sebzeyi dengeli şekilde bir araya getirir.",True,False,False,False,"[""Çilek ve şeftali meyvelerini uygun boyutta hazırlayın."", ""Blender haznesine süzme yoğurt, ispanak ve meyveleri ekleyin."", ""İsteğe göre birkaç buz küpü ve su ilavesi yapın."", ""Karışım pürüzsüz olana kadar blenderdan geçirin."", ""Bekletmeden servis edin.""]",NULL,0,False,7,1,"[""ara öğün"", ""smoothie"", ""sebze ağırlıklı"", ""meyveli"", ""demir kaynağı"", ""pratik""]",cilekli-seftalili-ve-ispanakli-smoothie-255d70,332,36.00,12.00,20.00
d70008ec-f301-5905-9b9e-467e40511964,dcdcbd23-7726-4f45-a0df-ddcd5a3b098c,Kekikli nohutlu bezelyeli çorbası,"Ölçülü yapılı bu çorba, baklagil bazlı yapısıyla kan şekeri stabilitesi ve kontrollü doygunluk sunar. Öğle ya da akşam öğününde hafif ama doyurucu bir alternatif oluşturur.",True,False,False,False,"[""Bezelye ve temel aromatik sebzeleri küçük küpler halinde doğrayın."", ""Tencerede kısa süre kavurup baklagili ekleyin."", ""Üzerini geçecek kadar sıcak su ilave edip kısık ateşte pişirin."", ""Kekikli dokunuşunu ekleyip kıvamı oturana kadar kaynatın."", ""İsterseniz kısmen blenderdan geçirip sıcak servis edin.""]",NULL,21,False,18,2,"[""çorba"", ""öğle yemeği"", ""denge"", ""baklagil"", ""lif"", ""hafif""]",kekikli-nohutlu-bezelyeli-corbasi-d70008,443,59.00,14.60,19.00
389e8399-58c7-51ec-9915-9f0df6d89cc2,dcdcbd23-7726-4f45-a0df-ddcd5a3b098c,Avokadolu fasulyeli bezelyeli wrap,"Kolay taşınabilir öğün düzeni hedefleyen bu wrap, taşınabilir yapısıyla yoğun günlerde iyi çalışır. İç dolgu dengeli karbonhidrat, protein ve sebzeyi aynı lokmada toplar.",True,False,False,False,"[""Kuru Fasulye harcını önceden pişirip ılıtın."", ""Bezelye ve diğer eşlikçileri ince jülyen halinde hazırlayın."", ""Tam Buğday Lavaş yüzeyine avokado ezmesi sürün."", ""Dolgu malzemelerini merkezde toplayıp sıkı şekilde sarın."", ""İkiye bölüp ılık ya da soğuk servis edin.""]",NULL,16,False,12,1,"[""öğle yemeği"", ""wrap"", ""ofis dostu"", ""baklagil"", ""sağlıklı yağ"", ""taşınabilir""]",avokadolu-fasulyeli-bezelyeli-wrap-389e83,581,79.00,17.40,27.00
1e094c65-9c9d-53ea-85d5-cf7f94c0bd42,dcdcbd23-7726-4f45-a0df-ddcd5a3b098c,Avokadolu lor peynirli havuçlu wrap,"Lif ve sağlıklı yağ dengesi hedefleyen bu wrap, taşınabilir yapısıyla yoğun günlerde iyi çalışır. İç dolgu dengeli karbonhidrat, protein ve sebzeyi aynı lokmada toplar.",True,False,False,False,"[""Lor Peyniri harcını önceden pişirip ılıtın."", ""Havuç ve diğer eşlikçileri ince jülyen halinde hazırlayın."", ""Tam Buğday Lavaş yüzeyine avokado ezmesi sürün."", ""Dolgu malzemelerini merkezde toplayıp sıkı şekilde sarın."", ""İkiye bölüp ılık ya da soğuk servis edin.""]",NULL,12,False,10,1,"[""öğle yemeği"", ""wrap"", ""akdeniz"", ""protein"", ""sağlıklı yağ"", ""taşınabilir""]",avokadolu-lor-peynirli-havuclu-wrap-1e094c,525,50.00,23.20,29.00
6a00dd0f-eca0-51c5-a87f-5061f35b2027,dcdcbd23-7726-4f45-a0df-ddcd5a3b098c,Biberiyeli tavuklu biberli fırın tepsisi,"Tok tutan ve dengeli bu ana öğün, tek tepside pratik hazırlık sunar. Tavuk Göğsü ile renkli biber uyumu hafif akşam yemekleri için güçlü bir seçenektir.",True,False,False,False,"[""Fırını önceden 190 dereceye ısıtın."", ""Tavuk Göğsü ve sebzeleri eşit pişecek boyutta hazırlayın."", ""Malzemeleri tepsiye yayıp zeytinyağı ve baharatlarla harmanlayın."", ""Biberiyeli dokunuşuyla lezzeti tamamlayın."", ""Kızarana kadar pişirip sıcak servis edin.""]",NULL,20,False,17,3,"[""akşam yemeği"", ""fırın"", ""yüksek protein"", ""renkli sebze"", ""biberiyeli""]",biberiyeli-tavuklu-biberli-firin-tepsisi-6a00dd,354,19.00,17.50,30.00
75be2e10-5b6f-5a58-a16f-a79ad7a9b93e,dcdcbd23-7726-4f45-a0df-ddcd5a3b098c,Fasulyeli kinoalı dolgulu renkli biber,"Pratik hazırlanabilen bu fırın yemeği, porsiyon kontrolünü kolaylaştıran düzenli bir ana öğündür. Renkli Biber içinde hazırlanan iç harç, gün içinde sürdürülebilir enerji desteği sunar.",True,False,False,False,"[""Renkli Biber içini hazırlayıp dolguluk hale getirin."", ""Kuru Fasulye ve kinoa bazlı iç harcı tavada kısa süre çevirin."", ""Naneli baharatlarını ekleyip iç harcı dengeleyin."", ""Sebzelerin içine paylaştırıp fırın kabına dizin."", ""Yumuşayana kadar pişirip sıcak servis edin.""]",NULL,24,False,16,3,"[""akşam yemeği"", ""dolma"", ""pratik"", ""baklagil"", ""kompleks karbonhidrat"", ""fırın""]",fasulyeli-kinoali-dolgulu-renkli-biber-75be2e,446,67.00,10.50,21.00
7bbbc5cc-f4a5-5ca6-ae6b-1cff9aeb416d,dcdcbd23-7726-4f45-a0df-ddcd5a3b098c,Naneli hindili esmer pirinç pilavı,"Hafif yapılı bu pilav tabağı, gün içi enerji ihtiyacını kontrollü karşılamak için tasarlandı. Tane tane doku ve dengeli protein miktarıyla günlük planlara kolayca uyum sağlar.",True,False,False,False,"[""Esmer Pirinç tabanını yıkayıp uygun kıvamda pişirin."", ""Hindi Göğsü ve sarımsak ile ayrı bir iç harç hazırlayın."", ""Pişen tahılı harçla birleştirip birkaç dakika dinlendirin."", ""Naneli ile aromayı canlandırın."", ""Ana öğün olarak sıcak servis edin.""]",NULL,18,False,13,2,"[""öğle yemeği"", ""pilav"", ""sebze ağırlıklı"", ""denge"", ""yüksek protein"", ""naneli""]",naneli-hindili-esmer-pirinc-pilavi-7bbbc5,488,38.00,23.10,32.00
c446d1ca-e454-5d4d-8965-661e4fb2bbc7,dcdcbd23-7726-4f45-a0df-ddcd5a3b098c,Kekikli fasulyeli bulgur pilavı,"Ölçülü yapılı bu pilav tabağı, gün içi enerji ihtiyacını kontrollü karşılamak için tasarlandı. Tane tane doku ve dengeli protein miktarıyla günlük planlara kolayca uyum sağlar.",True,False,False,False,"[""Bulgur tabanını yıkayıp uygun kıvamda pişirin."", ""Kuru Fasulye ve karnabahar ile ayrı bir iç harç hazırlayın."", ""Pişen tahılı harçla birleştirip birkaç dakika dinlendirin."", ""Kekikli ile aromayı canlandırın."", ""Ana öğün olarak sıcak servis edin.""]",NULL,21,False,12,3,"[""öğle yemeği"", ""pilav"", ""denge"", ""lif"", ""baklagil"", ""kekikli""]",kekikli-fasulyeli-bulgur-pilavi-c446d1,494,62.00,18.40,20.00
cead969c-2e0d-514f-b3d6-60c20cdc8221,dcdcbd23-7726-4f45-a0df-ddcd5a3b098c,Tofulu patlıcanlı kabak spagetti,"Ofis temposuna uygun bu tabak, klasik makarna hissini daha kontrollü bir içerikle sunar. Sos ve sebze dengesi sayesinde hafif ama tatmin edici bir alternatif oluşturur.",True,False,False,False,"[""Kabak Spagetti tabanını uygun süre boyunca pişirin."", ""Tofu ve patlıcan ile sos temelini hazırlayın."", ""Domates Sosu karışımını tavada kısa süre çevirin."", ""Haşlanan tabanı sos ile buluşturup birkaç dakika dinlendirin."", ""Sıcak servis edip taze otlarla tamamlayın.""]",NULL,15,False,9,2,"[""akşam yemeği"", ""makarna"", ""ofis dostu"", ""bitkisel protein"", ""düşük karbonhidrat"", ""kekikli""]",tofulu-patlicanli-kabak-spagetti-cead96,315,31.00,12.30,20.00
abe63b93-6d09-539e-9519-d60ff6b11988,dcdcbd23-7726-4f45-a0df-ddcd5a3b098c,Kekikli karnabaharlı ve patlıcanlı omlet,"Ferah ve renkli dokulu bu tarif, yumurta ve sebzeleri tek tavada bir araya getirir. Günün ilk yarısında dengeli bir protein kaynağı arayanlar için uygundur.",True,False,False,False,"[""Karnabahar ve patlıcan küçük parçalar halinde doğrayın."", ""Yapışmaz tavayı ısıtıp sebzeleri kısa süre soteleyin."", ""Yumurtaları çırpıp lor peyniri ile pürüzsüz hale getirin."", ""Karışımı tavaya dökün ve kısık ateşte kontrollü şekilde pişirin."", ""Omleti ikiye katlayıp sıcak servis edin.""]",NULL,14,False,12,1,"[""kahvaltı"", ""omlet"", ""akdeniz"", ""tava"", ""lif"", ""yüksek protein""]",kekikli-karnabaharli-ve-patlicanli-omlet-abe63b,463,17.00,25.70,41.00
ed62a5f8-efbf-55ba-9784-248f1a72b432,dcdcbd23-7726-4f45-a0df-ddcd5a3b098c,Vanilyalı elmalı kinoa ve lor peyniri kasesi,"Yüksek protein odaklı bu kahvaltı, kas korunumu ve uzun süreli tokluk için tasarlandı. Elma, kinoa ve lor peyniri birleşimiyle hafif ama dengeli bir başlangıç sunar.",True,False,False,False,"[""Kinoa tabanını uygun bir kapta hazırlayın; gerekiyorsa birkaç dakika önceden sıvı ile yumuşatın."", ""Lor Peyniri ile elma parçalarını ayrı bir kapta nazikçe karıştırın."", ""Kaseye önce kinoa tabanını, üzerine lor peyniri karışımını alın."", ""Badem ve seçtiğiniz baharat dokunuşunu üzerine serpin."", ""Kıvamı oturduktan sonra soğuk servis edin.""]",NULL,3,False,7,1,"[""kahvaltı"", ""kase"", ""yüksek protein"", ""kompleks karbonhidrat"", ""protein"", ""lif""]",vanilyali-elmali-kinoa-ve-lor-peyniri-kasesi-ed62a5,528,55.00,21.20,29.30
e290d676-8572-5a21-b0f8-5a0c7ac47de5,dcdcbd23-7726-4f45-a0df-ddcd5a3b098c,Naneli yaban mersinli kinoa ve lor peyniri kasesi,"Pratik hazırlanabilen bu kahvaltı, gün içinde sürdürülebilir enerji için tasarlandı. Yaban mersini, kinoa ve lor peyniri birleşimiyle hafif ama dengeli bir başlangıç sunar.",True,False,False,False,"[""Kinoa tabanını uygun bir kapta hazırlayın; gerekiyorsa birkaç dakika önceden sıvı ile yumuşatın."", ""Lor Peyniri ile yaban mersini parçalarını ayrı bir kapta nazikçe karıştırın."", ""Kaseye önce kinoa tabanını, üzerine lor peyniri karışımını alın."", ""Kabak Çekirdeği ve seçtiğiniz baharat dokunuşunu üzerine serpin."", ""Kıvamı oturduktan sonra soğuk servis edin.""]",NULL,4,False,10,1,"[""kahvaltı"", ""kase"", ""pratik"", ""kompleks karbonhidrat"", ""protein"", ""antioksidan""]",naneli-yaban-mersinli-kinoa-ve-lor-peyniri-kasesi-e290d6,491,48.00,19.40,31.00
9a9d497b-0060-56e1-bb77-72449047ae8b,dcdcbd23-7726-4f45-a0df-ddcd5a3b098c,Hardallı brokolili ve soğanlı omlet,"Hafif dokulu bu tarif, yumurta ve sebzeleri tek tavada bir araya getirir. Günün ilk yarısında dengeli bir protein kaynağı arayanlar için uygundur.",True,False,False,False,"[""Brokoli ve soğan küçük parçalar halinde doğrayın."", ""Yapışmaz tavayı ısıtıp sebzeleri kısa süre soteleyin."", ""Yumurtaları çırpıp lor peyniri ile pürüzsüz hale getirin."", ""Karışımı tavaya dökün ve kısık ateşte kontrollü şekilde pişirin."", ""Omleti ikiye katlayıp sıcak servis edin.""]",NULL,8,False,10,1,"[""kahvaltı"", ""omlet"", ""sebze ağırlıklı"", ""tava"", ""lif"", ""yüksek protein""]",hardalli-brokolili-ve-soganli-omlet-9a9d49,496,21.00,26.70,43.00
9788ef47-b59b-5756-ad3e-271f0ae45ce0,dcdcbd23-7726-4f45-a0df-ddcd5a3b098c,Hardallı semizotlu ve biberli omlet,"Ölçülü dokulu bu tarif, yumurta ve sebzeleri tek tavada bir araya getirir. Günün ilk yarısında dengeli bir protein kaynağı arayanlar için uygundur.",True,False,False,False,"[""Semizotu ve renkli biber küçük parçalar halinde doğrayın."", ""Yapışmaz tavayı ısıtıp sebzeleri kısa süre soteleyin."", ""Yumurtaları çırpıp süzme yoğurt ile pürüzsüz hale getirin."", ""Karışımı tavaya dökün ve kısık ateşte kontrollü şekilde pişirin."", ""Omleti ikiye katlayıp sıcak servis edin.""]",NULL,14,False,11,1,"[""kahvaltı"", ""omlet"", ""denge"", ""tava"", ""omega-3"", ""yüksek protein""]",hardalli-semizotlu-ve-biberli-omlet-9788ef,473,18.00,27.70,38.00
7394a56b-92f7-55c4-a23a-392623f18694,dcdcbd23-7726-4f45-a0df-ddcd5a3b098c,Kekikli havuçlu ve bezelyeli omlet,"Taşınabilir dokulu bu tarif, yumurta ve sebzeleri tek tavada bir araya getirir. Günün ilk yarısında dengeli bir protein kaynağı arayanlar için uygundur.",True,False,False,False,"[""Havuç ve bezelye küçük parçalar halinde doğrayın."", ""Yapışmaz tavayı ısıtıp sebzeleri kısa süre soteleyin."", ""Yumurtaları çırpıp süzme yoğurt ile pürüzsüz hale getirin."", ""Karışımı tavaya dökün ve kısık ateşte kontrollü şekilde pişirin."", ""Omleti ikiye katlayıp sıcak servis edin.""]",NULL,9,False,12,1,"[""kahvaltı"", ""omlet"", ""ofis dostu"", ""tava"", ""renkli sebze"", ""yüksek protein""]",kekikli-havuclu-ve-bezelyeli-omlet-7394a5,523,31.00,26.60,40.00
f3a9ddfd-f915-5abf-a21e-28de53c514da,dcdcbd23-7726-4f45-a0df-ddcd5a3b098c,Çilekli şeftalili ve semizotlu smoothie,"Akdeniz esintili ara öğün alternatifi olan bu smoothie, lif ve sağlıklı yağ dengesi hedefini destekler. Meyve ve yeşil sebzeyi dengeli şekilde bir araya getirir.",True,False,False,False,"[""Çilek ve şeftali meyvelerini uygun boyutta hazırlayın."", ""Blender haznesine lor peyniri, semizotu ve meyveleri ekleyin."", ""İsteğe göre birkaç buz küpü ve su ilavesi yapın."", ""Karışım pürüzsüz olana kadar blenderdan geçirin."", ""Bekletmeden servis edin.""]",NULL,0,False,9,1,"[""ara öğün"", ""smoothie"", ""akdeniz"", ""meyveli"", ""omega-3"", ""pratik""]",cilekli-seftalili-ve-semizotlu-smoothie-f3a9dd,327,33.00,11.00,24.00
199dd792-b423-5779-a51c-cd743df74b37,dcdcbd23-7726-4f45-a0df-ddcd5a3b098c,Kekikli fasulyeli bezelyeli çorbası,"Tok tutan yapılı bu çorba, baklagil bazlı yapısıyla kas korunumu ve uzun süreli tokluk sunar. Öğle ya da akşam öğününde hafif ama doyurucu bir alternatif oluşturur.",True,False,False,False,"[""Bezelye ve temel aromatik sebzeleri küçük küpler halinde doğrayın."", ""Tencerede kısa süre kavurup baklagili ekleyin."", ""Üzerini geçecek kadar sıcak su ilave edip kısık ateşte pişirin."", ""Kekikli dokunuşunu ekleyip kıvamı oturana kadar kaynatın."", ""İsterseniz kısmen blenderdan geçirip sıcak servis edin.""]",NULL,24,False,13,3,"[""çorba"", ""öğle yemeği"", ""yüksek protein"", ""baklagil"", ""lif"", ""hafif""]",kekikli-fasulyeli-bezelyeli-corbasi-199dd7,421,57.00,12.60,20.00
d67b68b8-fca4-54af-afd8-a1bc263c21d3,dcdcbd23-7726-4f45-a0df-ddcd5a3b098c,Yoğurt soslu nohutlu bezelyeli wrap,"Gün içinde sürdürülebilir enerji hedefleyen bu wrap, taşınabilir yapısıyla yoğun günlerde iyi çalışır. İç dolgu dengeli karbonhidrat, protein ve sebzeyi aynı lokmada toplar.",True,False,False,False,"[""Nohut harcını önceden pişirip ılıtın."", ""Bezelye ve diğer eşlikçileri ince jülyen halinde hazırlayın."", ""Tam Buğday Lavaş yüzeyine yoğurt sos sürün."", ""Dolgu malzemelerini merkezde toplayıp sıkı şekilde sarın."", ""İkiye bölüp ılık ya da soğuk servis edin.""]",NULL,12,False,10,1,"[""öğle yemeği"", ""wrap"", ""pratik"", ""baklagil"", ""hafif"", ""taşınabilir""]",yogurt-soslu-nohutlu-bezelyeli-wrap-d67b68,523,77.00,11.40,28.00
f8333f23-76b6-5e85-8e32-079dfdcf9af3,dcdcbd23-7726-4f45-a0df-ddcd5a3b098c,Labneli ton balıklı ıspanaklı wrap,"Mikrobesin çeşitliliği ve sindirim konforu hedefleyen bu wrap, taşınabilir yapısıyla yoğun günlerde iyi çalışır. İç dolgu dengeli karbonhidrat, protein ve sebzeyi aynı lokmada toplar.",True,False,False,False,"[""Ton Balığı harcını önceden pişirip ılıtın."", ""Ispanak ve diğer eşlikçileri ince jülyen halinde hazırlayın."", ""Tam Buğday Lavaş yüzeyine labne sürün."", ""Dolgu malzemelerini merkezde toplayıp sıkı şekilde sarın."", ""İkiye bölüp ılık ya da soğuk servis edin.""]",NULL,8,False,13,1,"[""öğle yemeği"", ""wrap"", ""sebze ağırlıklı"", ""balık"", ""pratik"", ""taşınabilir""]",labneli-ton-balikli-ispanakli-wrap-f8333f,476,37.00,20.40,36.00
3a3b571d-ffbc-532d-98a4-546343ac8888,dcdcbd23-7726-4f45-a0df-ddcd5a3b098c,Limonlu tavuklu karnabaharlı fırın tepsisi,"Ölçülü ve dengeli bu ana öğün, tek tepside pratik hazırlık sunar. Tavuk Göğsü ile karnabahar uyumu hafif akşam yemekleri için güçlü bir seçenektir.",True,False,False,False,"[""Fırını önceden 190 dereceye ısıtın."", ""Tavuk Göğsü ve sebzeleri eşit pişecek boyutta hazırlayın."", ""Malzemeleri tepsiye yayıp zeytinyağı ve baharatlarla harmanlayın."", ""Limonlu dokunuşuyla lezzeti tamamlayın."", ""Kızarana kadar pişirip sıcak servis edin.""]",NULL,30,False,14,2,"[""akşam yemeği"", ""fırın"", ""denge"", ""yüksek protein"", ""lif"", ""limonlu""]",limonlu-tavuklu-karnabaharli-firin-tepsisi-3a3b57,355,18.00,17.70,31.00
a3a78463-123b-5492-acf0-5a4399065b8e,dcdcbd23-7726-4f45-a0df-ddcd5a3b098c,Tavuklu esmer pirinçli dolgulu mantar,"Ofis temposuna uygun bu fırın yemeği, porsiyon kontrolünü kolaylaştıran düzenli bir ana öğündür. Mantar içinde hazırlanan iç harç, kolay taşınabilir öğün düzeni desteği sunar.",True,False,False,False,"[""Mantar içini hazırlayıp dolguluk hale getirin."", ""Tavuk Göğsü ve esmer pirinç bazlı iç harcı tavada kısa süre çevirin."", ""Kekikli baharatlarını ekleyip iç harcı dengeleyin."", ""Sebzelerin içine paylaştırıp fırın kabına dizin."", ""Yumuşayana kadar pişirip sıcak servis edin.""]",NULL,30,False,18,2,"[""akşam yemeği"", ""dolma"", ""ofis dostu"", ""yüksek protein"", ""denge"", ""fırın""]",tavuklu-esmer-pirincli-dolgulu-mantar-a3a784,462,47.00,14.50,36.00
a10d9a9e-21b9-5288-9e0b-bdc40c046a95,dcdcbd23-7726-4f45-a0df-ddcd5a3b098c,Vanilyalı kivili chia tohumu ve süzme yoğurt kasesi,"Akdeniz esintili bu kahvaltı, lif ve sağlıklı yağ dengesi için tasarlandı. Kivi, chia tohumu ve süzme yoğurt birleşimiyle hafif ama dengeli bir başlangıç sunar.",True,False,False,False,"[""Chia Tohumu tabanını uygun bir kapta hazırlayın; gerekiyorsa birkaç dakika önceden sıvı ile yumuşatın."", ""Süzme Yoğurt ile kivi parçalarını ayrı bir kapta nazikçe karıştırın."", ""Kaseye önce chia tohumu tabanını, üzerine süzme yoğurt karışımını alın."", ""Ceviz ve seçtiğiniz baharat dokunuşunu üzerine serpin."", ""Kıvamı oturduktan sonra soğuk servis edin.""]",NULL,3,False,12,1,"[""kahvaltı"", ""kase"", ""akdeniz"", ""omega-3"", ""fermente"", ""c vitamini""]",vanilyali-kivili-chia-tohumu-ve-suzme-yogurt-kasesi-a10d9a,478,36.00,26.40,24.00
b85871c8-8a44-5194-9385-2041a55c615b,dcdcbd23-7726-4f45-a0df-ddcd5a3b098c,Hindili mantarlı kabak spagetti,"Yüksek protein odaklı bu tabak, klasik makarna hissini daha kontrollü bir içerikle sunar. Sos ve sebze dengesi sayesinde hafif ama tatmin edici bir alternatif oluşturur.",True,False,False,False,"[""Kabak Spagetti tabanını uygun süre boyunca pişirin."", ""Hindi Göğsü ve mantar ile sos temelini hazırlayın."", ""Labne karışımını tavada kısa süre çevirin."", ""Haşlanan tabanı sos ile buluşturup birkaç dakika dinlendirin."", ""Sıcak servis edip taze otlarla tamamlayın.""]",NULL,22,False,11,2,"[""akşam yemeği"", ""makarna"", ""yüksek protein"", ""düşük karbonhidrat"", ""karabiberli""]",hindili-mantarli-kabak-spagetti-b85871,349,19.00,14.30,36.00
25023bab-3316-51dd-a56c-ab53160e641d,dcdcbd23-7726-4f45-a0df-ddcd5a3b098c,Ton balıklı biberli kabak spagetti,"Pratik hazırlanabilen bu tabak, klasik makarna hissini daha kontrollü bir içerikle sunar. Sos ve sebze dengesi sayesinde hafif ama tatmin edici bir alternatif oluşturur.",True,False,False,False,"[""Kabak Spagetti tabanını uygun süre boyunca pişirin."", ""Ton Balığı ve renkli biber ile sos temelini hazırlayın."", ""Yoğurt Sos karışımını tavada kısa süre çevirin."", ""Haşlanan tabanı sos ile buluşturup birkaç dakika dinlendirin."", ""Sıcak servis edip taze otlarla tamamlayın.""]",NULL,15,False,14,1,"[""akşam yemeği"", ""makarna"", ""pratik"", ""balık"", ""düşük karbonhidrat"", ""fesleğenli""]",ton-balikli-biberli-kabak-spagetti-25023b,332,22.00,13.30,31.00
23906c58-23e3-5850-abc6-4e10ce00e26d,dcdcbd23-7726-4f45-a0df-ddcd5a3b098c,Hindili patlıcanlı kabak spagetti,"Sebze ağırlıklı bu tabak, klasik makarna hissini daha kontrollü bir içerikle sunar. Sos ve sebze dengesi sayesinde hafif ama tatmin edici bir alternatif oluşturur.",True,False,False,False,"[""Kabak Spagetti tabanını uygun süre boyunca pişirin."", ""Hindi Göğsü ve patlıcan ile sos temelini hazırlayın."", ""Yoğurt Sos karışımını tavada kısa süre çevirin."", ""Haşlanan tabanı sos ile buluşturup birkaç dakika dinlendirin."", ""Sıcak servis edip taze otlarla tamamlayın.""]",NULL,16,False,11,2,"[""akşam yemeği"", ""makarna"", ""sebze ağırlıklı"", ""yüksek protein"", ""düşük karbonhidrat"", ""fesleğenli""]",hindili-patlicanli-kabak-spagetti-23906c,321,23.00,10.30,34.00
754f4831-b177-5db7-b9d8-33c3551f242a,dcdcbd23-7726-4f45-a0df-ddcd5a3b098c,Vanilyalı yaban mersinli chia tohumu ve süzme yoğurt kasesi,"Dengeli porsiyonlu bu kahvaltı, kan şekeri stabilitesi ve kontrollü doygunluk için tasarlandı. Yaban mersini, chia tohumu ve süzme yoğurt birleşimiyle hafif ama dengeli bir başlangıç sunar.",True,False,False,False,"[""Chia Tohumu tabanını uygun bir kapta hazırlayın; gerekiyorsa birkaç dakika önceden sıvı ile yumuşatın."", ""Süzme Yoğurt ile yaban mersini parçalarını ayrı bir kapta nazikçe karıştırın."", ""Kaseye önce chia tohumu tabanını, üzerine süzme yoğurt karışımını alın."", ""Kabak Çekirdeği ve seçtiğiniz baharat dokunuşunu üzerine serpin."", ""Kıvamı oturduktan sonra soğuk servis edin.""]",NULL,2,False,7,1,"[""kahvaltı"", ""kase"", ""denge"", ""omega-3"", ""fermente"", ""antioksidan""]",vanilyali-yaban-mersinli-chia-tohumu-ve-suzme-yogurt-kasesi-754f48,473,35.00,25.40,26.00
