Id,DietitianId,Name,Description,IsPublic,IsDemo,IsDraft,IsHiddenFromProduction,StepsJson,ArchivedAtUtc,CookTimeMinutes,IsArchived,PrepTimeMinutes,Servings,TagsJson,Slug,CaloriesKcal,CarbsGrams,FatGrams,ProteinGrams
2aaf96a2-c2bd-571a-b756-93c4b9696b59,dd000006-0000-0000-0000-000000000000,Kekikli mercimekli sarımsaklı çorbası,"Ferah ve renkli yapılı bu çorba, baklagil bazlı yapısıyla lif ve sağlıklı yağ dengesi sunar. Öğle ya da akşam öğününde hafif ama doyurucu bir alternatif oluşturur.",True,False,False,False,"[""Sarımsak ve temel aromatik sebzeleri küçük küpler halinde doğrayın."", ""Tencerede kısa süre kavurup baklagili ekleyin."", ""Üzerini geçecek kadar sıcak su ilave edip kısık ateşte pişirin."", ""Kekikli dokunuşunu ekleyip kıvamı oturana kadar kaynatın."", ""İsterseniz kısmen blenderdan geçirip sıcak servis edin.""]",NULL,31,False,10,2,"[""çorba"", ""öğle yemeği"", ""akdeniz"", ""baklagil"", ""lif"", ""aromatik"", ""hafif""]",kekikli-mercimekli-sarimsakli-corbasi-2aaf96,355,44.00,12.30,17.00
9a5fa126-820b-5658-9801-c123fc4e2264,dd000006-0000-0000-0000-000000000000,Zerdeçallı fasulyeli havuçlu çorbası,"Tok tutan yapılı bu çorba, baklagil bazlı yapısıyla kas korunumu ve uzun süreli tokluk sunar. Öğle ya da akşam öğününde hafif ama doyurucu bir alternatif oluşturur.",True,False,False,False,"[""Havuç ve temel aromatik sebzeleri küçük küpler halinde doğrayın."", ""Tencerede kısa süre kavurup baklagili ekleyin."", ""Üzerini geçecek kadar sıcak su ilave edip kısık ateşte pişirin."", ""Zerdeçallı dokunuşunu ekleyip kıvamı oturana kadar kaynatın."", ""İsterseniz kısmen blenderdan geçirip sıcak servis edin.""]",NULL,20,False,16,3,"[""çorba"", ""öğle yemeği"", ""yüksek protein"", ""baklagil"", ""lif"", ""renkli sebze"", ""hafif""]",zerdecalli-fasulyeli-havuclu-corbasi-9a5fa1,372,49.00,12.40,16.00
1852d58f-8a66-5374-8b04-4af6b6cba360,dd000006-0000-0000-0000-000000000000,Limonlu tofulu tam buğday makarna salata kasesi,"Pratik hazırlanabilen bu kase, tofu ve tam buğday makarna ile uzun süreli tokluk sağlar. Renkli sebzeler sayesinde tabağa canlı bir görünüm ve iyi bir lif dengesi ekler.",True,False,False,False,"[""Tam Buğday Makarna tabanını ayrı bir kapta haşlayıp süzün."", ""Tofu için tercih ettiğiniz pişirme yöntemini uygulayıp dilimleyin."", ""Brokoli ve eşlik edecek yeşillikleri hazırlayın."", ""Sos malzemelerini karıştırıp kaseyi katmanlı şekilde birleştirin."", ""Sosu servis öncesinde gezdirip hemen sunun.""]",NULL,19,False,15,1,"[""öğle yemeği"", ""salata kasesi"", ""pratik"", ""bitkisel protein"", ""tam tahıl"", ""limonlu""]",limonlu-tofulu-tam-bugday-makarna-salata-kasesi-1852d5,506,52.00,21.50,26.00
3c16bfa2-7775-546e-b8d9-f19747a9bc24,dd000006-0000-0000-0000-000000000000,Kekikli somonlu biberli fırın tepsisi,"Hafif ve dengeli bu ana öğün, tek tepside pratik hazırlık sunar. Somon Fileto ile renkli biber uyumu hafif akşam yemekleri için güçlü bir seçenektir.",True,False,False,False,"[""Fırını önceden 190 dereceye ısıtın."", ""Somon Fileto ve sebzeleri eşit pişecek boyutta hazırlayın."", ""Malzemeleri tepsiye yayıp zeytinyağı ve baharatlarla harmanlayın."", ""Kekikli dokunuşuyla lezzeti tamamlayın."", ""Kızarana kadar pişirip sıcak servis edin.""]",NULL,18,False,17,2,"[""akşam yemeği"", ""fırın"", ""sebze ağırlıklı"", ""omega-3"", ""renkli sebze"", ""kekikli""]",kekikli-somonlu-biberli-firin-tepsisi-3c16bf,423,16.00,26.60,30.00
d29cc450-c4ff-5b6f-82d5-56cd0d42b92c,dd000006-0000-0000-0000-000000000000,Biberiyeli somonlu bezelyeli fırın tepsisi,"Ölçülü ve dengeli bu ana öğün, tek tepside pratik hazırlık sunar. Somon Fileto ile bezelye uyumu hafif akşam yemekleri için güçlü bir seçenektir.",True,False,False,False,"[""Fırını önceden 190 dereceye ısıtın."", ""Somon Fileto ve sebzeleri eşit pişecek boyutta hazırlayın."", ""Malzemeleri tepsiye yayıp zeytinyağı ve baharatlarla harmanlayın."", ""Biberiyeli dokunuşuyla lezzeti tamamlayın."", ""Kızarana kadar pişirip sıcak servis edin.""]",NULL,20,False,18,3,"[""akşam yemeği"", ""fırın"", ""denge"", ""omega-3"", ""lif"", ""biberiyeli""]",biberiyeli-somonlu-bezelyeli-firin-tepsisi-d29cc4,473,25.00,26.80,33.00
187c6c12-90b2-5a16-b3be-2aee3c9f28e5,dd000006-0000-0000-0000-000000000000,Tarçınlı böğürtlenli chia tohumu ve süzme yoğurt kasesi,"Ofis temposuna uygun bu kahvaltı, kolay taşınabilir öğün düzeni için tasarlandı. Böğürtlen, chia tohumu ve süzme yoğurt birleşimiyle hafif ama dengeli bir başlangıç sunar.",True,False,False,False,"[""Chia Tohumu tabanını uygun bir kapta hazırlayın; gerekiyorsa birkaç dakika önceden sıvı ile yumuşatın."", ""Süzme Yoğurt ile böğürtlen parçalarını ayrı bir kapta nazikçe karıştırın."", ""Kaseye önce chia tohumu tabanını, üzerine süzme yoğurt karışımını alın."", ""Ceviz ve seçtiğiniz baharat dokunuşunu üzerine serpin."", ""Kıvamı oturduktan sonra soğuk servis edin.""]",NULL,2,False,10,1,"[""kahvaltı"", ""kase"", ""ofis dostu"", ""omega-3"", ""fermente"", ""antioksidan""]",tarcinli-bogurtlenli-chia-tohumu-ve-suzme-yogurt-kasesi-187c6c,474,35.00,26.50,24.00
0f90c551-bd13-5668-a177-6a859bd9c712,dd000006-0000-0000-0000-000000000000,Vanilyalı armutlu kinoa ve lor peyniri kasesi,"Akdeniz esintili bu kahvaltı, lif ve sağlıklı yağ dengesi için tasarlandı. Armut, kinoa ve lor peyniri birleşimiyle hafif ama dengeli bir başlangıç sunar.",True,False,False,False,"[""Kinoa tabanını uygun bir kapta hazırlayın; gerekiyorsa birkaç dakika önceden sıvı ile yumuşatın."", ""Lor Peyniri ile armut parçalarını ayrı bir kapta nazikçe karıştırın."", ""Kaseye önce kinoa tabanını, üzerine lor peyniri karışımını alın."", ""Ceviz ve seçtiğiniz baharat dokunuşunu üzerine serpin."", ""Kıvamı oturduktan sonra soğuk servis edin.""]",NULL,2,False,12,1,"[""kahvaltı"", ""kase"", ""akdeniz"", ""kompleks karbonhidrat"", ""protein"", ""lif""]",vanilyali-armutlu-kinoa-ve-lor-peyniri-kasesi-0f90c5,515,55.00,20.20,28.40
501bc485-44b8-5189-a334-597982333731,dd000006-0000-0000-0000-000000000000,Tofulu kabaklı kabak spagetti,"Yüksek protein odaklı bu tabak, klasik makarna hissini daha kontrollü bir içerikle sunar. Sos ve sebze dengesi sayesinde hafif ama tatmin edici bir alternatif oluşturur.",True,False,False,False,"[""Kabak Spagetti tabanını uygun süre boyunca pişirin."", ""Tofu ve kabak ile sos temelini hazırlayın."", ""Labne karışımını tavada kısa süre çevirin."", ""Haşlanan tabanı sos ile buluşturup birkaç dakika dinlendirin."", ""Sıcak servis edip taze otlarla tamamlayın.""]",NULL,13,False,11,2,"[""akşam yemeği"", ""makarna"", ""yüksek protein"", ""bitkisel protein"", ""düşük karbonhidrat"", ""karabiberli""]",tofulu-kabakli-kabak-spagetti-501bc4,343,24.00,17.20,23.00
bb0d7cdc-6fc1-5852-b40d-9c95132f7d3f,dd000006-0000-0000-0000-000000000000,Tarçınlı kivili yulaf ve lor peyniri kasesi,"Pratik hazırlanabilen bu kahvaltı, gün içinde sürdürülebilir enerji için tasarlandı. Kivi, yulaf ve lor peyniri birleşimiyle hafif ama dengeli bir başlangıç sunar.",True,False,False,False,"[""Yulaf tabanını uygun bir kapta hazırlayın; gerekiyorsa birkaç dakika önceden sıvı ile yumuşatın."", ""Lor Peyniri ile kivi parçalarını ayrı bir kapta nazikçe karıştırın."", ""Kaseye önce yulaf tabanını, üzerine lor peyniri karışımını alın."", ""Keten Tohumu ve seçtiğiniz baharat dokunuşunu üzerine serpin."", ""Kıvamı oturduktan sonra soğuk servis edin.""]",NULL,2,False,8,1,"[""kahvaltı"", ""kase"", ""pratik"", ""protein"", ""c vitamini""]",tarcinli-kivili-yulaf-ve-lor-peyniri-kasesi-bb0d7c,457,47.00,17.40,28.00
d716c3d6-f665-5abb-91af-9190d6d89df2,dd000006-0000-0000-0000-000000000000,Hardallı ıspanaklı ve havuçlu omlet,"Hafif dokulu bu tarif, yumurta ve sebzeleri tek tavada bir araya getirir. Günün ilk yarısında dengeli bir protein kaynağı arayanlar için uygundur.",True,False,False,False,"[""Ispanak ve havuç küçük parçalar halinde doğrayın."", ""Yapışmaz tavayı ısıtıp sebzeleri kısa süre soteleyin."", ""Yumurtaları çırpıp süzme yoğurt ile pürüzsüz hale getirin."", ""Karışımı tavaya dökün ve kısık ateşte kontrollü şekilde pişirin."", ""Omleti ikiye katlayıp sıcak servis edin.""]",NULL,11,False,11,1,"[""kahvaltı"", ""omlet"", ""sebze ağırlıklı"", ""tava"", ""demir kaynağı"", ""yüksek protein""]",hardalli-ispanakli-ve-havuclu-omlet-d716c3,480,20.00,27.60,38.00
e725dc0b-d2e8-51a9-a0a6-e1237d0730d2,dd000006-0000-0000-0000-000000000000,Naneli mantarlı ve soğanlı omlet,"Ölçülü dokulu bu tarif, yumurta ve sebzeleri tek tavada bir araya getirir. Günün ilk yarısında dengeli bir protein kaynağı arayanlar için uygundur.",True,False,False,False,"[""Mantar ve soğan küçük parçalar halinde doğrayın."", ""Yapışmaz tavayı ısıtıp sebzeleri kısa süre soteleyin."", ""Yumurtaları çırpıp süzme yoğurt ile pürüzsüz hale getirin."", ""Karışımı tavaya dökün ve kısık ateşte kontrollü şekilde pişirin."", ""Omleti ikiye katlayıp sıcak servis edin.""]",NULL,14,False,12,1,"[""kahvaltı"", ""omlet"", ""denge"", ""tava"", ""hafif"", ""yüksek protein""]",naneli-mantarli-ve-soganli-omlet-e725dc,474,21.00,26.50,38.00
e705edee-28f1-5fc4-9ed7-c45e2a293047,dd000006-0000-0000-0000-000000000000,Naneli sarımsaklı ve ıspanaklı omlet,"Taşınabilir dokulu bu tarif, yumurta ve sebzeleri tek tavada bir araya getirir. Günün ilk yarısında dengeli bir protein kaynağı arayanlar için uygundur.",True,False,False,False,"[""Sarımsak ve ispanak küçük parçalar halinde doğrayın."", ""Yapışmaz tavayı ısıtıp sebzeleri kısa süre soteleyin."", ""Yumurtaları çırpıp lor peyniri ile pürüzsüz hale getirin."", ""Karışımı tavaya dökün ve kısık ateşte kontrollü şekilde pişirin."", ""Omleti ikiye katlayıp sıcak servis edin.""]",NULL,13,False,11,1,"[""kahvaltı"", ""omlet"", ""ofis dostu"", ""tava"", ""aromatik"", ""yüksek protein""]",naneli-sarimsakli-ve-ispanakli-omlet-e705ed,442,12.00,25.50,41.00
74747556-aeea-5d33-b972-a664f906be04,dd000006-0000-0000-0000-000000000000,Hardallı patlıcanlı ve biberli omlet,"Ferah ve renkli dokulu bu tarif, yumurta ve sebzeleri tek tavada bir araya getirir. Günün ilk yarısında dengeli bir protein kaynağı arayanlar için uygundur.",True,False,False,False,"[""Patlıcan ve renkli biber küçük parçalar halinde doğrayın."", ""Yapışmaz tavayı ısıtıp sebzeleri kısa süre soteleyin."", ""Yumurtaları çırpıp lor peyniri ile pürüzsüz hale getirin."", ""Karışımı tavaya dökün ve kısık ateşte kontrollü şekilde pişirin."", ""Omleti ikiye katlayıp sıcak servis edin.""]",NULL,11,False,12,1,"[""kahvaltı"", ""omlet"", ""akdeniz"", ""tava"", ""fırın"", ""yüksek protein""]",hardalli-patlicanli-ve-biberli-omlet-747475,475,18.00,26.60,41.00
2f76f24c-f777-5dc7-82c8-51ac436a3cf0,dd000006-0000-0000-0000-000000000000,Hardallı ıspanaklı ve sarımsaklı omlet,"Tok tutan dokulu bu tarif, yumurta ve sebzeleri tek tavada bir araya getirir. Günün ilk yarısında dengeli bir protein kaynağı arayanlar için uygundur.",True,False,False,False,"[""Ispanak ve sarımsak küçük parçalar halinde doğrayın."", ""Yapışmaz tavayı ısıtıp sebzeleri kısa süre soteleyin."", ""Yumurtaları çırpıp lor peyniri ile pürüzsüz hale getirin."", ""Karışımı tavaya dökün ve kısık ateşte kontrollü şekilde pişirin."", ""Omleti ikiye katlayıp sıcak servis edin.""]",NULL,8,False,11,1,"[""kahvaltı"", ""omlet"", ""yüksek protein"", ""tava"", ""demir kaynağı""]",hardalli-ispanakli-ve-sarimsakli-omlet-2f76f2,458,13.00,26.50,42.00
2fa57593-81b5-5fbc-a0e4-4f3e3b8b61e5,dd000006-0000-0000-0000-000000000000,Şeftalili yaban mersinli ve havuçlu smoothie,"Pratik hazırlanabilen ara öğün alternatifi olan bu smoothie, gün içinde sürdürülebilir enerji hedefini destekler. Meyve ve yeşil sebzeyi dengeli şekilde bir araya getirir.",True,False,False,False,"[""Şeftali ve yaban mersini meyvelerini uygun boyutta hazırlayın."", ""Blender haznesine süzme yoğurt, havuç ve meyveleri ekleyin."", ""İsteğe göre birkaç buz küpü ve su ilavesi yapın."", ""Karışım pürüzsüz olana kadar blenderdan geçirin."", ""Bekletmeden servis edin.""]",NULL,0,False,10,1,"[""ara öğün"", ""smoothie"", ""pratik"", ""yaz meyvesi"", ""renkli sebze""]",seftalili-yaban-mersinli-ve-havuclu-smoothie-2fa575,351,42.00,11.90,19.00
96c73d05-eaa0-501d-9585-a80e98c38a74,dd000006-0000-0000-0000-000000000000,Humuslu süzme yoğurtlu kabaklı wrap,"Mikrobesin çeşitliliği ve sindirim konforu hedefleyen bu wrap, taşınabilir yapısıyla yoğun günlerde iyi çalışır. İç dolgu dengeli karbonhidrat, protein ve sebzeyi aynı lokmada toplar.",True,False,False,False,"[""Süzme Yoğurt harcını önceden pişirip ılıtın."", ""Kabak ve diğer eşlikçileri ince jülyen halinde hazırlayın."", ""Tam Buğday Lavaş yüzeyine humus sürün."", ""Dolgu malzemelerini merkezde toplayıp sıkı şekilde sarın."", ""İkiye bölüp ılık ya da soğuk servis edin.""]",NULL,9,False,14,1,"[""öğle yemeği"", ""wrap"", ""sebze ağırlıklı"", ""fermente"", ""baklagil"", ""taşınabilir""]",humuslu-suzme-yogurtlu-kabakli-wrap-96c73d,506,53.00,20.20,28.00
082f3ed5-f69a-5d53-840b-e9ca995746f1,dd000006-0000-0000-0000-000000000000,Tavuklu karabuğdaylı dolgulu kabak,"Dengeli porsiyonlu bu fırın yemeği, porsiyon kontrolünü kolaylaştıran düzenli bir ana öğündür. Kabak içinde hazırlanan iç harç, kan şekeri stabilitesi ve kontrollü doygunluk desteği sunar.",True,False,False,False,"[""Kabak içini hazırlayıp dolguluk hale getirin."", ""Tavuk Göğsü ve karabuğday bazlı iç harcı tavada kısa süre çevirin."", ""Kekikli baharatlarını ekleyip iç harcı dengeleyin."", ""Sebzelerin içine paylaştırıp fırın kabına dizin."", ""Yumuşayana kadar pişirip sıcak servis edin.""]",NULL,32,False,14,2,"[""akşam yemeği"", ""dolma"", ""denge"", ""yüksek protein"", ""glutensiz"", ""fırın""]",tavuklu-karabugdayli-dolgulu-kabak-082f3e,442,43.00,14.40,35.00
d1056f10-4a56-54b7-8e52-cf1077333bb6,dd000006-0000-0000-0000-000000000000,Fesleğenli somonlu tam buğday makarna salata kasesi,"Ofis temposuna uygun bu kase, somon fileto ve tam buğday makarna ile uzun süreli tokluk sağlar. Renkli sebzeler sayesinde tabağa canlı bir görünüm ve iyi bir lif dengesi ekler.",True,False,False,False,"[""Tam Buğday Makarna tabanını ayrı bir kapta haşlayıp süzün."", ""Somon Fileto için tercih ettiğiniz pişirme yöntemini uygulayıp dilimleyin."", ""Pancar ve eşlik edecek yeşillikleri hazırlayın."", ""Sos malzemelerini karıştırıp kaseyi katmanlı şekilde birleştirin."", ""Sosu servis öncesinde gezdirip hemen sunun.""]",NULL,18,False,12,1,"[""öğle yemeği"", ""salata kasesi"", ""ofis dostu"", ""omega-3"", ""tam tahıl"", ""fesleğenli""]",feslegenli-somonlu-tam-bugday-makarna-salata-kasesi-d1056f,590,49.00,28.20,35.00
4a9d2954-5225-5646-9ead-7999f8e5045c,dd000006-0000-0000-0000-000000000000,Humuslu mercimekli ıspanaklı wrap,"Lif ve sağlıklı yağ dengesi hedefleyen bu wrap, taşınabilir yapısıyla yoğun günlerde iyi çalışır. İç dolgu dengeli karbonhidrat, protein ve sebzeyi aynı lokmada toplar.",True,False,False,False,"[""Yeşil Mercimek harcını önceden pişirip ılıtın."", ""Ispanak ve diğer eşlikçileri ince jülyen halinde hazırlayın."", ""Tam Buğday Lavaş yüzeyine humus sürün."", ""Dolgu malzemelerini merkezde toplayıp sıkı şekilde sarın."", ""İkiye bölüp ılık ya da soğuk servis edin.""]",NULL,13,False,13,1,"[""öğle yemeği"", ""wrap"", ""akdeniz"", ""baklagil"", ""taşınabilir""]",humuslu-mercimekli-ispanakli-wrap-4a9d29,509,69.00,13.40,28.00
03e2829e-3da3-5dd8-ab76-29ea61df0f2d,dd000006-0000-0000-0000-000000000000,Biberiyeli somonlu patlıcanlı fırın tepsisi,"Tok tutan ve dengeli bu ana öğün, tek tepside pratik hazırlık sunar. Somon Fileto ile patlıcan uyumu hafif akşam yemekleri için güçlü bir seçenektir.",True,False,False,False,"[""Fırını önceden 190 dereceye ısıtın."", ""Somon Fileto ve sebzeleri eşit pişecek boyutta hazırlayın."", ""Malzemeleri tepsiye yayıp zeytinyağı ve baharatlarla harmanlayın."", ""Biberiyeli dokunuşuyla lezzeti tamamlayın."", ""Kızarana kadar pişirip sıcak servis edin.""]",NULL,19,False,13,3,"[""akşam yemeği"", ""fırın"", ""yüksek protein"", ""omega-3"", ""biberiyeli""]",biberiyeli-somonlu-patlicanli-firin-tepsisi-03e282,418,17.00,26.50,28.00
25440f46-35e2-5106-8062-9ab842bf875a,dd000006-0000-0000-0000-000000000000,Tofulu kinoalı dolgulu mantar,"Pratik hazırlanabilen bu fırın yemeği, porsiyon kontrolünü kolaylaştıran düzenli bir ana öğündür. Mantar içinde hazırlanan iç harç, gün içinde sürdürülebilir enerji desteği sunar.",True,False,False,False,"[""Mantar içini hazırlayıp dolguluk hale getirin."", ""Tofu ve kinoa bazlı iç harcı tavada kısa süre çevirin."", ""Naneli baharatlarını ekleyip iç harcı dengeleyin."", ""Sebzelerin içine paylaştırıp fırın kabına dizin."", ""Yumuşayana kadar pişirip sıcak servis edin.""]",NULL,26,False,22,3,"[""akşam yemeği"", ""dolma"", ""pratik"", ""bitkisel protein"", ""kompleks karbonhidrat"", ""fırın""]",tofulu-kinoali-dolgulu-mantar-25440f,442,46.00,17.50,25.00
999b9329-76f5-58f1-9b8b-56fe0bd22868,dd000006-0000-0000-0000-000000000000,Labneli nohutlu kerevizli wrap,"Mikrobesin çeşitliliği ve sindirim konforu hedefleyen bu wrap, taşınabilir yapısıyla yoğun günlerde iyi çalışır. İç dolgu dengeli karbonhidrat, protein ve sebzeyi aynı lokmada toplar.",True,False,False,False,"[""Nohut harcını önceden pişirip ılıtın."", ""Kereviz ve diğer eşlikçileri ince jülyen halinde hazırlayın."", ""Tam Buğday Lavaş yüzeyine labne sürün."", ""Dolgu malzemelerini merkezde toplayıp sıkı şekilde sarın."", ""İkiye bölüp ılık ya da soğuk servis edin.""]",NULL,12,False,14,1,"[""öğle yemeği"", ""wrap"", ""sebze ağırlıklı"", ""baklagil"", ""pratik"", ""taşınabilir""]",labneli-nohutlu-kerevizli-wrap-999b93,497,66.00,15.20,24.00
665d7d2b-d4b8-56eb-af1f-9ac38e76dc8b,dd000006-0000-0000-0000-000000000000,Kekikli semizotlu ve soğanlı omlet,"Ölçülü dokulu bu tarif, yumurta ve sebzeleri tek tavada bir araya getirir. Günün ilk yarısında dengeli bir protein kaynağı arayanlar için uygundur.",True,False,False,False,"[""Semizotu ve soğan küçük parçalar halinde doğrayın."", ""Yapışmaz tavayı ısıtıp sebzeleri kısa süre soteleyin."", ""Yumurtaları çırpıp lor peyniri ile pürüzsüz hale getirin."", ""Karışımı tavaya dökün ve kısık ateşte kontrollü şekilde pişirin."", ""Omleti ikiye katlayıp sıcak servis edin.""]",NULL,13,False,13,1,"[""kahvaltı"", ""omlet"", ""denge"", ""tava"", ""omega-3"", ""yüksek protein""]",kekikli-semizotlu-ve-soganli-omlet-665d7d,462,17.00,25.60,41.00
ca81bad8-b7cb-57c7-ba57-4238294e1060,dd000006-0000-0000-0000-000000000000,Naneli soğanlı ve semizotlu omlet,"Taşınabilir dokulu bu tarif, yumurta ve sebzeleri tek tavada bir araya getirir. Günün ilk yarısında dengeli bir protein kaynağı arayanlar için uygundur.",True,False,False,False,"[""Soğan ve semizotu küçük parçalar halinde doğrayın."", ""Yapışmaz tavayı ısıtıp sebzeleri kısa süre soteleyin."", ""Yumurtaları çırpıp süzme yoğurt ile pürüzsüz hale getirin."", ""Karışımı tavaya dökün ve kısık ateşte kontrollü şekilde pişirin."", ""Omleti ikiye katlayıp sıcak servis edin.""]",NULL,13,False,13,1,"[""kahvaltı"", ""omlet"", ""ofis dostu"", ""tava"", ""aromatik"", ""yüksek protein""]",naneli-soganli-ve-semizotlu-omlet-ca81ba,467,20.00,26.60,37.00
d17aa040-d65a-54d0-b1bd-d6293b4b3e03,dd000006-0000-0000-0000-000000000000,Tavuklu sarımsaklı tam buğday makarna,"Akdeniz esintili bu tabak, klasik makarna hissini daha kontrollü bir içerikle sunar. Sos ve sebze dengesi sayesinde hafif ama tatmin edici bir alternatif oluşturur.",True,False,False,False,"[""Tam Buğday Makarna tabanını uygun süre boyunca pişirin."", ""Tavuk Göğsü ve sarımsak ile sos temelini hazırlayın."", ""Yoğurt Sos karışımını tavada kısa süre çevirin."", ""Haşlanan tabanı sos ile buluşturup birkaç dakika dinlendirin."", ""Sıcak servis edip taze otlarla tamamlayın.""]",NULL,21,False,11,2,"[""akşam yemeği"", ""makarna"", ""akdeniz"", ""yüksek protein"", ""tam tahıl"", ""fesleğenli""]",tavuklu-sarimsakli-tam-bugday-makarna-d17aa0,461,48.00,12.10,40.00
6237feec-be94-534e-a8ba-45da82b989fa,dd000006-0000-0000-0000-000000000000,Mandalinalı çilekli ve ıspanaklı smoothie,"Yüksek protein odaklı ara öğün alternatifi olan bu smoothie, kas korunumu ve uzun süreli tokluk hedefini destekler. Meyve ve yeşil sebzeyi dengeli şekilde bir araya getirir.",True,False,False,False,"[""Mandalina ve çilek meyvelerini uygun boyutta hazırlayın."", ""Blender haznesine süzme yoğurt, ispanak ve meyveleri ekleyin."", ""İsteğe göre birkaç buz küpü ve su ilavesi yapın."", ""Karışım pürüzsüz olana kadar blenderdan geçirin."", ""Bekletmeden servis edin.""]",NULL,0,False,7,1,"[""ara öğün"", ""smoothie"", ""yüksek protein"", ""c vitamini"", ""demir kaynağı"", ""pratik""]",mandalinali-cilekli-ve-ispanakli-smoothie-6237fe,328,35.00,12.00,20.00
3efe6e13-f900-5ab8-bf5b-2dbdbd4d7542,dd000006-0000-0000-0000-000000000000,Kekikli biberli ve patlıcanlı omlet,"Hızlı hazırlanabilen dokulu bu tarif, yumurta ve sebzeleri tek tavada bir araya getirir. Günün ilk yarısında dengeli bir protein kaynağı arayanlar için uygundur.",True,False,False,False,"[""Renkli Biber ve patlıcan küçük parçalar halinde doğrayın."", ""Yapışmaz tavayı ısıtıp sebzeleri kısa süre soteleyin."", ""Yumurtaları çırpıp süzme yoğurt ile pürüzsüz hale getirin."", ""Karışımı tavaya dökün ve kısık ateşte kontrollü şekilde pişirin."", ""Omleti ikiye katlayıp sıcak servis edin.""]",NULL,14,False,8,1,"[""kahvaltı"", ""omlet"", ""pratik"", ""tava"", ""renkli sebze"", ""yüksek protein""]",kekikli-biberli-ve-patlicanli-omlet-3efe6e,463,20.00,26.60,36.00
f16e6a01-3562-5c72-ab77-ee6fbda5a411,dd000006-0000-0000-0000-000000000000,Vanilyalı çilekli yulaf ve süzme yoğurt kasesi,"Sebze ağırlıklı bu kahvaltı, mikrobesin çeşitliliği ve sindirim konforu için tasarlandı. Çilek, yulaf ve süzme yoğurt birleşimiyle hafif ama dengeli bir başlangıç sunar.",True,False,False,False,"[""Yulaf tabanını uygun bir kapta hazırlayın; gerekiyorsa birkaç dakika önceden sıvı ile yumuşatın."", ""Süzme Yoğurt ile çilek parçalarını ayrı bir kapta nazikçe karıştırın."", ""Kaseye önce yulaf tabanını, üzerine süzme yoğurt karışımını alın."", ""Ceviz ve seçtiğiniz baharat dokunuşunu üzerine serpin."", ""Kıvamı oturduktan sonra soğuk servis edin.""]",NULL,2,False,9,1,"[""kahvaltı"", ""kase"", ""sebze ağırlıklı"", ""fermente"", ""meyveli""]",vanilyali-cilekli-yulaf-ve-suzme-yogurt-kasesi-f16e6a,493,48.00,22.30,25.00
f0aa7036-9a5c-54a0-b812-a5be577b585b,dd000006-0000-0000-0000-000000000000,Naneli armutlu kinoa ve süzme yoğurt kasesi,"Dengeli porsiyonlu bu kahvaltı, kan şekeri stabilitesi ve kontrollü doygunluk için tasarlandı. Armut, kinoa ve süzme yoğurt birleşimiyle hafif ama dengeli bir başlangıç sunar.",True,False,False,False,"[""Kinoa tabanını uygun bir kapta hazırlayın; gerekiyorsa birkaç dakika önceden sıvı ile yumuşatın."", ""Süzme Yoğurt ile armut parçalarını ayrı bir kapta nazikçe karıştırın."", ""Kaseye önce kinoa tabanını, üzerine süzme yoğurt karışımını alın."", ""Ceviz ve seçtiğiniz baharat dokunuşunu üzerine serpin."", ""Kıvamı oturduktan sonra soğuk servis edin.""]",NULL,1,False,13,1,"[""kahvaltı"", ""kase"", ""denge"", ""kompleks karbonhidrat"", ""fermente"", ""lif""]",naneli-armutlu-kinoa-ve-suzme-yogurt-kasesi-f0aa70,520,58.00,21.20,24.40
aa4d2a5d-e2d1-5c25-ae05-99358b9209a2,dd000006-0000-0000-0000-000000000000,Narlı kivili ve havuçlu smoothie,"Ofis temposuna uygun ara öğün alternatifi olan bu smoothie, kolay taşınabilir öğün düzeni hedefini destekler. Meyve ve yeşil sebzeyi dengeli şekilde bir araya getirir.",True,False,False,False,"[""Nar ve kivi meyvelerini uygun boyutta hazırlayın."", ""Blender haznesine süzme yoğurt, havuç ve meyveleri ekleyin."", ""İsteğe göre birkaç buz küpü ve su ilavesi yapın."", ""Karışım pürüzsüz olana kadar blenderdan geçirin."", ""Bekletmeden servis edin.""]",NULL,0,False,6,1,"[""ara öğün"", ""smoothie"", ""ofis dostu"", ""antioksidan"", ""renkli sebze"", ""pratik""]",narli-kivili-ve-havuclu-smoothie-aa4d2a,361,44.00,12.10,19.00
b3df55ac-f6e5-5490-b948-5c5221a82d08,dd000006-0000-0000-0000-000000000000,Şeftalili çilekli ve havuçlu smoothie,"Akdeniz esintili ara öğün alternatifi olan bu smoothie, lif ve sağlıklı yağ dengesi hedefini destekler. Meyve ve yeşil sebzeyi dengeli şekilde bir araya getirir.",True,False,False,False,"[""Şeftali ve çilek meyvelerini uygun boyutta hazırlayın."", ""Blender haznesine süzme yoğurt, havuç ve meyveleri ekleyin."", ""İsteğe göre birkaç buz küpü ve su ilavesi yapın."", ""Karışım pürüzsüz olana kadar blenderdan geçirin."", ""Bekletmeden servis edin.""]",NULL,0,False,10,1,"[""ara öğün"", ""smoothie"", ""akdeniz"", ""yaz meyvesi"", ""renkli sebze"", ""pratik""]",seftalili-cilekli-ve-havuclu-smoothie-b3df55,342,40.00,11.80,19.00
