Id,DietitianId,Name,Description,IsPublic,IsDemo,IsDraft,IsHiddenFromProduction,StepsJson,ArchivedAtUtc,CookTimeMinutes,IsArchived,PrepTimeMinutes,Servings,TagsJson,Slug,CaloriesKcal,CarbsGrams,FatGrams,ProteinGrams
58a71edc-192d-5888-9ec9-e9e34155a15d,583b8a61-ebee-4dec-8bf0-cf2ca1aa6095,Tofulu mantarlı kabak spagetti,"Ofis temposuna uygun bu tabak, klasik makarna hissini daha kontrollü bir içerikle sunar. Sos ve sebze dengesi sayesinde hafif ama tatmin edici bir alternatif oluşturur.",True,False,False,False,"[""Kabak Spagetti tabanını uygun süre boyunca pişirin."", ""Tofu ve mantar ile sos temelini hazırlayın."", ""Yoğurt Sos karışımını tavada kısa süre çevirin."", ""Haşlanan tabanı sos ile buluşturup birkaç dakika dinlendirin."", ""Sıcak servis edip taze otlarla tamamlayın.""]",NULL,21,False,10,2,"[""akşam yemeği"", ""makarna"", ""ofis dostu"", ""bitkisel protein"", ""düşük karbonhidrat"", ""karabiberli""]",tofulu-mantarli-kabak-spagetti-58a71e,320,25.00,13.30,25.00
53b4887e-3a85-5d15-8908-894d9866a2cc,583b8a61-ebee-4dec-8bf0-cf2ca1aa6095,Yoğurt soslu lor peynirli sandviç,"Akdeniz esintili bu sandviç, dışarıda yemek gereken günlerde planı korumayı kolaylaştırır. Tam Buğday Ekmeği tabanı ve dengeli iç harcı sayesinde hızlı ama doyurucu bir seçenek sunar.",True,False,False,False,"[""Tam Buğday Ekmeği dilimlerini hafifçe ısıtın."", ""Yüzeye önce yoğurt sos, ardından lor peyniri katmanını ekleyin."", ""Patlıcan ile taze bir katman oluşturun."", ""Sandviçi sıkı şekilde kapatıp ikiye bölün."", ""İsteğe göre yanında ayran veya salata ile servis edin.""]",NULL,4,False,11,1,"[""öğle yemeği"", ""sandviç"", ""akdeniz"", ""protein"", ""taşınabilir""]",yogurt-soslu-lor-peynirli-sandvic-53b488,412,42.00,13.30,31.00
48998da9-8142-5f01-ac23-8a56200fd8cd,583b8a61-ebee-4dec-8bf0-cf2ca1aa6095,Elmalı chia tohumu puding,"Tok tutan ara öğün olarak hazırlanan bu puding, kontrollü tatlı isteği için iyi bir alternatiftir. Protein ve lif desteğiyle gereksiz atıştırmayı azaltmaya yardımcı olur.",True,False,False,False,"[""Chia Tohumu tabanını sıvı bileşenle karıştırıp dinlenmeye bırakın."", ""Lor Peyniri ile yumuşak bir kıvam hazırlayın."", ""Elma dilimleri ve tabanı katmanlı şekilde birleştirin."", ""Hindistan Cevizi ile dokusal kontrast ekleyin."", ""Soğutup servis edin.""]",NULL,0,False,10,1,"[""ara öğün"", ""puding"", ""yüksek protein"", ""omega-3"", ""lif"", ""tatlı ihtiyacına çözüm""]",elmali-chia-tohumu-puding-48998d,457,39.00,22.20,25.30
742dd399-33ad-5d46-b228-a05cb4791985,583b8a61-ebee-4dec-8bf0-cf2ca1aa6095,Limonlu hindili ana tabak,"Hızlı hazırlanabilen bu tarif, akşam öğününde daha düzenli bir tabak kurmak isteyenler için hazırlandı. Hindi Göğsü ile karabuğday eşleşmesi dengeli makro dağılımı sunar.",True,False,False,False,"[""Hindi Göğsü ana malzemesini tercih ettiğiniz yöntemle pişirin."", ""Karabuğday garnitürünü ayrı kapta hazırlayın."", ""Havuç eşlikçisini diri kalacak şekilde pişirin."", ""Tüm parçaları tabakta dengeli porsiyonla birleştirin."", ""Servis öncesi son baharat dokunuşunu ekleyin.""]",NULL,16,False,12,2,"[""akşam yemeği"", ""ana tabak"", ""pratik"", ""yüksek protein"", ""glutensiz"", ""limonlu""]",limonlu-hindili-ana-tabak-742dd3,511,38.00,25.20,33.00
29ccfe9a-57ab-5391-9a4f-a6d204c648be,583b8a61-ebee-4dec-8bf0-cf2ca1aa6095,Armutlu narlı ve semizotlu smoothie,"Sebze ağırlıklı ara öğün alternatifi olan bu smoothie, mikrobesin çeşitliliği ve sindirim konforu hedefini destekler. Meyve ve yeşil sebzeyi dengeli şekilde bir araya getirir.",True,False,False,False,"[""Armut ve nar meyvelerini uygun boyutta hazırlayın."", ""Blender haznesine süzme yoğurt, semizotu ve meyveleri ekleyin."", ""İsteğe göre birkaç buz küpü ve su ilavesi yapın."", ""Karışım pürüzsüz olana kadar blenderdan geçirin."", ""Bekletmeden servis edin.""]",NULL,0,False,10,1,"[""ara öğün"", ""smoothie"", ""sebze ağırlıklı"", ""lif"", ""omega-3"", ""pratik""]",armutlu-narli-ve-semizotlu-smoothie-29ccfe,370,46.00,12.10,19.40
bca964a9-028d-5ab9-bc65-00e2658dfe2d,583b8a61-ebee-4dec-8bf0-cf2ca1aa6095,Tarçınlı yaban mersinli yulaf ve süzme yoğurt kasesi,"Dengeli porsiyonlu bu kahvaltı, kan şekeri stabilitesi ve kontrollü doygunluk için tasarlandı. Yaban mersini, yulaf ve süzme yoğurt birleşimiyle hafif ama dengeli bir başlangıç sunar.",True,False,False,False,"[""Yulaf tabanını uygun bir kapta hazırlayın; gerekiyorsa birkaç dakika önceden sıvı ile yumuşatın."", ""Süzme Yoğurt ile yaban mersini parçalarını ayrı bir kapta nazikçe karıştırın."", ""Kaseye önce yulaf tabanını, üzerine süzme yoğurt karışımını alın."", ""Ceviz ve seçtiğiniz baharat dokunuşunu üzerine serpin."", ""Kıvamı oturduktan sonra soğuk servis edin.""]",NULL,1,False,10,1,"[""kahvaltı"", ""kase"", ""denge"", ""fermente"", ""antioksidan""]",tarcinli-yaban-mersinli-yulaf-ve-suzme-yogurt-kasesi-bca964,502,50.00,22.40,25.00
59e51032-5aa2-51b3-9896-b7e3454f70db,583b8a61-ebee-4dec-8bf0-cf2ca1aa6095,Hardallı soğanlı ve kabaklı omlet,"Taşınabilir dokulu bu tarif, yumurta ve sebzeleri tek tavada bir araya getirir. Günün ilk yarısında dengeli bir protein kaynağı arayanlar için uygundur.",True,False,False,False,"[""Soğan ve kabak küçük parçalar halinde doğrayın."", ""Yapışmaz tavayı ısıtıp sebzeleri kısa süre soteleyin."", ""Yumurtaları çırpıp süzme yoğurt ile pürüzsüz hale getirin."", ""Karışımı tavaya dökün ve kısık ateşte kontrollü şekilde pişirin."", ""Omleti ikiye katlayıp sıcak servis edin.""]",NULL,14,False,13,1,"[""kahvaltı"", ""omlet"", ""ofis dostu"", ""tava"", ""aromatik"", ""yüksek protein""]",hardalli-soganli-ve-kabakli-omlet-59e510,483,22.00,27.40,37.00
c2a406b8-ceb5-5bff-8599-c771993dab5f,583b8a61-ebee-4dec-8bf0-cf2ca1aa6095,Narlı böğürtlenli ve semizotlu smoothie,"Akdeniz esintili ara öğün alternatifi olan bu smoothie, lif ve sağlıklı yağ dengesi hedefini destekler. Meyve ve yeşil sebzeyi dengeli şekilde bir araya getirir.",True,False,False,False,"[""Nar ve böğürtlen meyvelerini uygun boyutta hazırlayın."", ""Blender haznesine süzme yoğurt, semizotu ve meyveleri ekleyin."", ""İsteğe göre birkaç buz küpü ve su ilavesi yapın."", ""Karışım pürüzsüz olana kadar blenderdan geçirin."", ""Bekletmeden servis edin.""]",NULL,0,False,9,1,"[""ara öğün"", ""smoothie"", ""akdeniz"", ""antioksidan"", ""omega-3"", ""pratik""]",narli-bogurtlenli-ve-semizotlu-smoothie-c2a406,348,39.00,12.40,20.00
ae240e77-b86b-5d86-bbfe-6cdeef67f2ea,583b8a61-ebee-4dec-8bf0-cf2ca1aa6095,Zerdeçallı mercimekli brokolili çorbası,"Tok tutan yapılı bu çorba, baklagil bazlı yapısıyla kas korunumu ve uzun süreli tokluk sunar. Öğle ya da akşam öğününde hafif ama doyurucu bir alternatif oluşturur.",True,False,False,False,"[""Brokoli ve temel aromatik sebzeleri küçük küpler halinde doğrayın."", ""Tencerede kısa süre kavurup baklagili ekleyin."", ""Üzerini geçecek kadar sıcak su ilave edip kısık ateşte pişirin."", ""Zerdeçallı dokunuşunu ekleyip kıvamı oturana kadar kaynatın."", ""İsterseniz kısmen blenderdan geçirip sıcak servis edin.""]",NULL,34,False,10,3,"[""çorba"", ""öğle yemeği"", ""yüksek protein"", ""baklagil"", ""lif"", ""hafif""]",zerdecalli-mercimekli-brokolili-corbasi-ae240e,378,47.00,12.70,19.00
456ce30a-18e1-5136-843c-055158425047,583b8a61-ebee-4dec-8bf0-cf2ca1aa6095,Yoğurt soslu lor peynirli sarımsaklı wrap,"Gün içinde sürdürülebilir enerji hedefleyen bu wrap, taşınabilir yapısıyla yoğun günlerde iyi çalışır. İç dolgu dengeli karbonhidrat, protein ve sebzeyi aynı lokmada toplar.",True,False,False,False,"[""Lor Peyniri harcını önceden pişirip ılıtın."", ""Sarımsak ve diğer eşlikçileri ince jülyen halinde hazırlayın."", ""Tam Buğday Lavaş yüzeyine yoğurt sos sürün."", ""Dolgu malzemelerini merkezde toplayıp sıkı şekilde sarın."", ""İkiye bölüp ılık ya da soğuk servis edin.""]",NULL,10,False,13,1,"[""öğle yemeği"", ""wrap"", ""pratik"", ""protein"", ""hafif"", ""taşınabilir""]",yogurt-soslu-lor-peynirli-sarimsakli-wrap-456ce3,428,42.00,15.10,31.00
5174e158-729e-5ce2-b2ea-66a1e7f2a161,583b8a61-ebee-4dec-8bf0-cf2ca1aa6095,Avokadolu mercimekli kabaklı wrap,"Mikrobesin çeşitliliği ve sindirim konforu hedefleyen bu wrap, taşınabilir yapısıyla yoğun günlerde iyi çalışır. İç dolgu dengeli karbonhidrat, protein ve sebzeyi aynı lokmada toplar.",True,False,False,False,"[""Yeşil Mercimek harcını önceden pişirip ılıtın."", ""Kabak ve diğer eşlikçileri ince jülyen halinde hazırlayın."", ""Tam Buğday Lavaş yüzeyine avokado ezmesi sürün."", ""Dolgu malzemelerini merkezde toplayıp sıkı şekilde sarın."", ""İkiye bölüp ılık ya da soğuk servis edin.""]",NULL,8,False,10,1,"[""öğle yemeği"", ""wrap"", ""sebze ağırlıklı"", ""baklagil"", ""sağlıklı yağ"", ""taşınabilir""]",avokadolu-mercimekli-kabakli-wrap-5174e1,519,67.00,17.20,24.00
977e9043-2bf4-5186-9e96-36ed560c3bc9,583b8a61-ebee-4dec-8bf0-cf2ca1aa6095,Kekikli tofulu kerevizli fırın tepsisi,"Ölçülü ve dengeli bu ana öğün, tek tepside pratik hazırlık sunar. Tofu ile kereviz uyumu hafif akşam yemekleri için güçlü bir seçenektir.",True,False,False,False,"[""Fırını önceden 190 dereceye ısıtın."", ""Tofu ve sebzeleri eşit pişecek boyutta hazırlayın."", ""Malzemeleri tepsiye yayıp zeytinyağı ve baharatlarla harmanlayın."", ""Kekikli dokunuşuyla lezzeti tamamlayın."", ""Kızarana kadar pişirip sıcak servis edin.""]",NULL,29,False,13,3,"[""akşam yemeği"", ""fırın"", ""denge"", ""bitkisel protein"", ""hafif"", ""kekikli""]",kekikli-tofulu-kerevizli-firin-tepsisi-977e90,326,20.00,19.30,18.00
a1ac0c3c-8a55-5660-b859-5c384379f36e,583b8a61-ebee-4dec-8bf0-cf2ca1aa6095,Havuçlu mercimekli mini köfte,"Taşınabilir bu tarif, kontrollü porsiyonda hazırlanabilen çok yönlü bir tabak sunar. Yanına eklenen sos ile ara öğün ya da ana öğün olarak değerlendirilebilir.",True,False,False,False,"[""Yeşil Mercimek bazını robotta çekip havuç ile karıştırın."", ""Baharatları ekleyip şekil alacak kıvama getirin."", ""Karışımdan küçük parçalar alıp köfte formu verin."", ""Tavada ya da fırında kontrollü şekilde pişirin."", ""Yoğurt Sos ile birlikte servis edin.""]",NULL,14,False,13,3,"[""pratik"", ""köfte"", ""ofis dostu"", ""baklagil"", ""renkli sebze"", ""yüksek tokluk""]",havuclu-mercimekli-mini-kofte-a1ac0c,519,44.00,21.20,38.00
7e124d48-fa81-5356-b91c-e13d02d0bf01,583b8a61-ebee-4dec-8bf0-cf2ca1aa6095,Fesleğenli tavuklu sebze sote,"Akdeniz esintili bu tava yemeği, tek kapta pişen düzenli bir öğün sunar. Tavuk Göğsü ve sebzelerin diri dokusu sayesinde hafif ama tatmin edicidir.",True,False,False,False,"[""Tavuk Göğsü uygun boyutta hazırlayın."", ""Ispanak ve brokoli sebzelerini benzer büyüklükte doğrayın."", ""Wok ya da geniş tavayı iyice ısıtıp malzemeleri sırasıyla ekleyin."", ""Fesleğenli aroması ile son dokunuşu yapın."", ""Sebzeler hafif diri kalacak şekilde servis edin.""]",NULL,10,False,13,1,"[""ana öğün"", ""sote"", ""akdeniz"", ""yüksek protein"", ""demir kaynağı"", ""tek tava""]",feslegenli-tavuklu-sebze-sote-7e124d,373,20.00,17.90,33.00
125cd1b5-61ce-5ede-94da-c52a57e730ed,583b8a61-ebee-4dec-8bf0-cf2ca1aa6095,Labneli süzme yoğurtlu sandviç,"Yüksek protein odaklı bu sandviç, dışarıda yemek gereken günlerde planı korumayı kolaylaştırır. Ekşi Mayalı Ekmek tabanı ve dengeli iç harcı sayesinde hızlı ama doyurucu bir seçenek sunar.",True,False,False,False,"[""Ekşi Mayalı Ekmek dilimlerini hafifçe ısıtın."", ""Yüzeye önce labne, ardından süzme yoğurt katmanını ekleyin."", ""Brokoli ile taze bir katman oluşturun."", ""Sandviçi sıkı şekilde kapatıp ikiye bölün."", ""İsteğe göre yanında ayran veya salata ile servis edin.""]",NULL,7,False,11,1,"[""öğle yemeği"", ""sandviç"", ""yüksek protein"", ""fermente"", ""taşınabilir""]",labneli-suzme-yogurtlu-sandvic-125cd1,450,42.00,18.50,29.00
02145f8b-4162-5fa4-b925-d2243a25c823,583b8a61-ebee-4dec-8bf0-cf2ca1aa6095,Naneli tavuklu bulgur pilavı,"Hızlı hazırlanabilen yapılı bu pilav tabağı, gün içi enerji ihtiyacını kontrollü karşılamak için tasarlandı. Tane tane doku ve dengeli protein miktarıyla günlük planlara kolayca uyum sağlar.",True,False,False,False,"[""Bulgur tabanını yıkayıp uygun kıvamda pişirin."", ""Tavuk Göğsü ve kereviz ile ayrı bir iç harç hazırlayın."", ""Pişen tahılı harçla birleştirip birkaç dakika dinlendirin."", ""Naneli ile aromayı canlandırın."", ""Ana öğün olarak sıcak servis edin.""]",NULL,16,False,11,3,"[""öğle yemeği"", ""pilav"", ""pratik"", ""lif"", ""yüksek protein"", ""naneli""]",naneli-tavuklu-bulgur-pilavi-02145f,489,37.00,23.20,33.00
b53a3222-a213-537f-8430-28ed1ae9e9ef,583b8a61-ebee-4dec-8bf0-cf2ca1aa6095,Lor peynirli semizotlu kabak spagetti,"Sebze ağırlıklı bu tabak, klasik makarna hissini daha kontrollü bir içerikle sunar. Sos ve sebze dengesi sayesinde hafif ama tatmin edici bir alternatif oluşturur.",True,False,False,False,"[""Kabak Spagetti tabanını uygun süre boyunca pişirin."", ""Lor Peyniri ve semizotu ile sos temelini hazırlayın."", ""Labne karışımını tavada kısa süre çevirin."", ""Haşlanan tabanı sos ile buluşturup birkaç dakika dinlendirin."", ""Sıcak servis edip taze otlarla tamamlayın.""]",NULL,18,False,15,1,"[""akşam yemeği"", ""makarna"", ""sebze ağırlıklı"", ""protein"", ""düşük karbonhidrat"", ""kekikli""]",lor-peynirli-semizotlu-kabak-spagetti-b53a32,352,23.00,16.40,28.00
627a74e4-4425-58d1-9b27-7bee59764173,583b8a61-ebee-4dec-8bf0-cf2ca1aa6095,Şeftalili chia tohumu puding,"Ölçülü ara öğün olarak hazırlanan bu puding, kontrollü tatlı isteği için iyi bir alternatiftir. Protein ve lif desteğiyle gereksiz atıştırmayı azaltmaya yardımcı olur.",True,False,False,False,"[""Chia Tohumu tabanını sıvı bileşenle karıştırıp dinlenmeye bırakın."", ""Süzme Yoğurt ile yumuşak bir kıvam hazırlayın."", ""Şeftali dilimleri ve tabanı katmanlı şekilde birleştirin."", ""Ceviz ile dokusal kontrast ekleyin."", ""Soğutup servis edin.""]",NULL,0,False,11,1,"[""ara öğün"", ""puding"", ""denge"", ""omega-3"", ""yaz meyvesi"", ""tatlı ihtiyacına çözüm""]",seftalili-chia-tohumu-puding-627a74,481,37.00,26.30,24.00
a9c07a84-b4e4-5090-919f-a3a2118c5225,583b8a61-ebee-4dec-8bf0-cf2ca1aa6095,Vanilyalı şeftalili kinoa ve lor peyniri kasesi,"Ofis temposuna uygun bu kahvaltı, kolay taşınabilir öğün düzeni için tasarlandı. Şeftali, kinoa ve lor peyniri birleşimiyle hafif ama dengeli bir başlangıç sunar.",True,False,False,False,"[""Kinoa tabanını uygun bir kapta hazırlayın; gerekiyorsa birkaç dakika önceden sıvı ile yumuşatın."", ""Lor Peyniri ile şeftali parçalarını ayrı bir kapta nazikçe karıştırın."", ""Kaseye önce kinoa tabanını, üzerine lor peyniri karışımını alın."", ""Badem ve seçtiğiniz baharat dokunuşunu üzerine serpin."", ""Kıvamı oturduktan sonra soğuk servis edin.""]",NULL,3,False,10,1,"[""kahvaltı"", ""kase"", ""ofis dostu"", ""kompleks karbonhidrat"", ""protein"", ""yaz meyvesi""]",vanilyali-seftalili-kinoa-ve-lor-peyniri-kasesi-a9c07a,520,52.00,21.30,30.00
bf9f18de-5240-5fbc-a74e-cfb623e26233,583b8a61-ebee-4dec-8bf0-cf2ca1aa6095,Hardallı hindili ana tabak,"Ferah ve renkli bu tarif, akşam öğününde daha düzenli bir tabak kurmak isteyenler için hazırlandı. Hindi Göğsü ile kinoa eşleşmesi dengeli makro dağılımı sunar.",True,False,False,False,"[""Hindi Göğsü ana malzemesini tercih ettiğiniz yöntemle pişirin."", ""Kinoa garnitürünü ayrı kapta hazırlayın."", ""Semizotu eşlikçisini diri kalacak şekilde pişirin."", ""Tüm parçaları tabakta dengeli porsiyonla birleştirin."", ""Servis öncesi son baharat dokunuşunu ekleyin.""]",NULL,27,False,18,2,"[""akşam yemeği"", ""ana tabak"", ""akdeniz"", ""yüksek protein"", ""kompleks karbonhidrat"", ""hardallı""]",hardalli-hindili-ana-tabak-bf9f18,519,33.00,27.40,35.00
5eb49e0d-72fe-529e-967b-5b4734813567,7c83aa64-8d48-41a3-a26a-e3ff91f15b88,Armutlu yulaf puding,"Ferah ve renkli ara öğün olarak hazırlanan bu puding, kontrollü tatlı isteği için iyi bir alternatiftir. Protein ve lif desteğiyle gereksiz atıştırmayı azaltmaya yardımcı olur.",True,False,False,False,"[""Yulaf tabanını sıvı bileşenle karıştırıp dinlenmeye bırakın."", ""Lor Peyniri ile yumuşak bir kıvam hazırlayın."", ""Armut dilimleri ve tabanı katmanlı şekilde birleştirin."", ""Ceviz ile dokusal kontrast ekleyin."", ""Soğutup servis edin.""]",NULL,0,False,14,1,"[""ara öğün"", ""puding"", ""akdeniz"", ""kahvaltı"", ""lif"", ""tatlı ihtiyacına çözüm""]",armutlu-yulaf-puding-5eb49e,516,53.00,21.20,28.40
56382989-1217-5ba8-b0c4-2b8cf4d47465,7c83aa64-8d48-41a3-a26a-e3ff91f15b88,Vanilyalı yaban mersinli yulaf ve lor peyniri kasesi,"Yüksek protein odaklı bu kahvaltı, kas korunumu ve uzun süreli tokluk için tasarlandı. Yaban mersini, yulaf ve lor peyniri birleşimiyle hafif ama dengeli bir başlangıç sunar.",True,False,False,False,"[""Yulaf tabanını uygun bir kapta hazırlayın; gerekiyorsa birkaç dakika önceden sıvı ile yumuşatın."", ""Lor Peyniri ile yaban mersini parçalarını ayrı bir kapta nazikçe karıştırın."", ""Kaseye önce yulaf tabanını, üzerine lor peyniri karışımını alın."", ""Kabak Çekirdeği ve seçtiğiniz baharat dokunuşunu üzerine serpin."", ""Kıvamı oturduktan sonra soğuk servis edin.""]",NULL,4,False,13,1,"[""kahvaltı"", ""kase"", ""yüksek protein"", ""protein"", ""antioksidan""]",vanilyali-yaban-mersinli-yulaf-ve-lor-peyniri-kasesi-563829,496,47.00,20.40,31.00
cc274eea-91f6-521d-90ce-68b3b91052ac,7c83aa64-8d48-41a3-a26a-e3ff91f15b88,Hardallı havuçlu ve kerevizli omlet,"Hızlı hazırlanabilen dokulu bu tarif, yumurta ve sebzeleri tek tavada bir araya getirir. Günün ilk yarısında dengeli bir protein kaynağı arayanlar için uygundur.",True,False,False,False,"[""Havuç ve kereviz küçük parçalar halinde doğrayın."", ""Yapışmaz tavayı ısıtıp sebzeleri kısa süre soteleyin."", ""Yumurtaları çırpıp süzme yoğurt ile pürüzsüz hale getirin."", ""Karışımı tavaya dökün ve kısık ateşte kontrollü şekilde pişirin."", ""Omleti ikiye katlayıp sıcak servis edin.""]",NULL,10,False,9,1,"[""kahvaltı"", ""omlet"", ""pratik"", ""tava"", ""renkli sebze"", ""yüksek protein""]",hardalli-havuclu-ve-kerevizli-omlet-cc274e,483,22.00,27.40,37.00
0d1ebbab-1911-5473-a8c7-9adb0526f938,7c83aa64-8d48-41a3-a26a-e3ff91f15b88,Vanilyalı armutlu yulaf ve lor peyniri kasesi,"Sebze ağırlıklı bu kahvaltı, mikrobesin çeşitliliği ve sindirim konforu için tasarlandı. Armut, yulaf ve lor peyniri birleşimiyle hafif ama dengeli bir başlangıç sunar.",True,False,False,False,"[""Yulaf tabanını uygun bir kapta hazırlayın; gerekiyorsa birkaç dakika önceden sıvı ile yumuşatın."", ""Lor Peyniri ile armut parçalarını ayrı bir kapta nazikçe karıştırın."", ""Kaseye önce yulaf tabanını, üzerine lor peyniri karışımını alın."", ""Ceviz ve seçtiğiniz baharat dokunuşunu üzerine serpin."", ""Kıvamı oturduktan sonra soğuk servis edin.""]",NULL,0,False,7,1,"[""kahvaltı"", ""kase"", ""sebze ağırlıklı"", ""protein"", ""lif""]",vanilyali-armutlu-yulaf-ve-lor-peyniri-kasesi-0d1ebb,520,54.00,21.20,28.40
5f4e2480-85da-5de0-a4b3-3f258491925d,7c83aa64-8d48-41a3-a26a-e3ff91f15b88,Naneli bezelyeli ve biberli omlet,"Ölçülü dokulu bu tarif, yumurta ve sebzeleri tek tavada bir araya getirir. Günün ilk yarısında dengeli bir protein kaynağı arayanlar için uygundur.",True,False,False,False,"[""Bezelye ve renkli biber küçük parçalar halinde doğrayın."", ""Yapışmaz tavayı ısıtıp sebzeleri kısa süre soteleyin."", ""Yumurtaları çırpıp süzme yoğurt ile pürüzsüz hale getirin."", ""Karışımı tavaya dökün ve kısık ateşte kontrollü şekilde pişirin."", ""Omleti ikiye katlayıp sıcak servis edin.""]",NULL,8,False,11,1,"[""kahvaltı"", ""omlet"", ""denge"", ""tava"", ""lif"", ""yüksek protein""]",naneli-bezelyeli-ve-biberli-omlet-5f4e24,516,29.00,26.70,40.00
06224451-2e8a-55b7-bef3-13d660c73ba3,7c83aa64-8d48-41a3-a26a-e3ff91f15b88,Çilekli böğürtlenli ve semizotlu smoothie,"Ofis temposuna uygun ara öğün alternatifi olan bu smoothie, kolay taşınabilir öğün düzeni hedefini destekler. Meyve ve yeşil sebzeyi dengeli şekilde bir araya getirir.",True,False,False,False,"[""Çilek ve böğürtlen meyvelerini uygun boyutta hazırlayın."", ""Blender haznesine süzme yoğurt, semizotu ve meyveleri ekleyin."", ""İsteğe göre birkaç buz küpü ve su ilavesi yapın."", ""Karışım pürüzsüz olana kadar blenderdan geçirin."", ""Bekletmeden servis edin.""]",NULL,0,False,10,1,"[""ara öğün"", ""smoothie"", ""ofis dostu"", ""meyveli"", ""omega-3"", ""pratik""]",cilekli-bogurtlenli-ve-semizotlu-smoothie-062244,322,33.00,12.20,20.00
44ed14ac-1bfd-502b-9f2e-727ba1bb929e,7c83aa64-8d48-41a3-a26a-e3ff91f15b88,Zencefilli mercimekli ıspanaklı çorbası,"Ferah ve renkli yapılı bu çorba, baklagil bazlı yapısıyla lif ve sağlıklı yağ dengesi sunar. Öğle ya da akşam öğününde hafif ama doyurucu bir alternatif oluşturur.",True,False,False,False,"[""Ispanak ve temel aromatik sebzeleri küçük küpler halinde doğrayın."", ""Tencerede kısa süre kavurup baklagili ekleyin."", ""Üzerini geçecek kadar sıcak su ilave edip kısık ateşte pişirin."", ""Zencefilli dokunuşunu ekleyip kıvamı oturana kadar kaynatın."", ""İsterseniz kısmen blenderdan geçirip sıcak servis edin.""]",NULL,26,False,18,3,"[""çorba"", ""öğle yemeği"", ""akdeniz"", ""baklagil"", ""lif"", ""demir kaynağı"", ""hafif""]",zencefilli-mercimekli-ispanakli-corbasi-44ed14,361,44.00,12.60,18.00
a6d2c687-4ad7-53a1-a59d-d5f991520366,7c83aa64-8d48-41a3-a26a-e3ff91f15b88,Limonlu nohutlu karabuğday salata kasesi,"Yüksek protein odaklı bu kase, nohut ve karabuğday ile uzun süreli tokluk sağlar. Renkli sebzeler sayesinde tabağa canlı bir görünüm ve iyi bir lif dengesi ekler.",True,False,False,False,"[""Karabuğday tabanını ayrı bir kapta haşlayıp süzün."", ""Nohut için tercih ettiğiniz pişirme yöntemini uygulayıp dilimleyin."", ""Brokoli ve eşlik edecek yeşillikleri hazırlayın."", ""Sos malzemelerini karıştırıp kaseyi katmanlı şekilde birleştirin."", ""Sosu servis öncesinde gezdirip hemen sunun.""]",NULL,21,False,10,1,"[""öğle yemeği"", ""salata kasesi"", ""yüksek protein"", ""baklagil"", ""glutensiz"", ""limonlu""]",limonlu-nohutlu-karabugday-salata-kasesi-a6d2c6,504,68.00,16.50,21.00
fd5b5b6e-3d76-5f26-96f3-e8b27e1e15de,7c83aa64-8d48-41a3-a26a-e3ff91f15b88,Limonlu levrekli mantarlı fırın tepsisi,"Hızlı hazırlanabilen ve dengeli bu ana öğün, tek tepside pratik hazırlık sunar. Levrek Fileto ile mantar uyumu hafif akşam yemekleri için güçlü bir seçenektir.",True,False,False,False,"[""Fırını önceden 190 dereceye ısıtın."", ""Levrek Fileto ve sebzeleri eşit pişecek boyutta hazırlayın."", ""Malzemeleri tepsiye yayıp zeytinyağı ve baharatlarla harmanlayın."", ""Limonlu dokunuşuyla lezzeti tamamlayın."", ""Kızarana kadar pişirip sıcak servis edin.""]",NULL,23,False,12,2,"[""akşam yemeği"", ""fırın"", ""pratik"", ""balık"", ""hafif"", ""limonlu""]",limonlu-levrekli-mantarli-firin-tepsisi-fd5b5b,370,16.00,20.70,30.00
26431237-f930-56b2-8871-8b652455cf93,7c83aa64-8d48-41a3-a26a-e3ff91f15b88,Limonlu tavuklu havuçlu fırın tepsisi,"Hafif ve dengeli bu ana öğün, tek tepside pratik hazırlık sunar. Tavuk Göğsü ile havuç uyumu hafif akşam yemekleri için güçlü bir seçenektir.",True,False,False,False,"[""Fırını önceden 190 dereceye ısıtın."", ""Tavuk Göğsü ve sebzeleri eşit pişecek boyutta hazırlayın."", ""Malzemeleri tepsiye yayıp zeytinyağı ve baharatlarla harmanlayın."", ""Limonlu dokunuşuyla lezzeti tamamlayın."", ""Kızarana kadar pişirip sıcak servis edin.""]",NULL,30,False,16,2,"[""akşam yemeği"", ""fırın"", ""sebze ağırlıklı"", ""yüksek protein"", ""renkli sebze"", ""limonlu""]",limonlu-tavuklu-havuclu-firin-tepsisi-264312,410,29.00,17.60,34.00
f6b709fd-5d20-5714-a38f-a0e3c6f7466c,7c83aa64-8d48-41a3-a26a-e3ff91f15b88,Mercimekli kinoalı dolgulu renkli biber,"Dengeli porsiyonlu bu fırın yemeği, porsiyon kontrolünü kolaylaştıran düzenli bir ana öğündür. Renkli Biber içinde hazırlanan iç harç, kan şekeri stabilitesi ve kontrollü doygunluk desteği sunar.",True,False,False,False,"[""Renkli Biber içini hazırlayıp dolguluk hale getirin."", ""Yeşil Mercimek ve kinoa bazlı iç harcı tavada kısa süre çevirin."", ""Fesleğenli baharatlarını ekleyip iç harcı dengeleyin."", ""Sebzelerin içine paylaştırıp fırın kabına dizin."", ""Yumuşayana kadar pişirip sıcak servis edin.""]",NULL,35,False,14,2,"[""akşam yemeği"", ""dolma"", ""denge"", ""baklagil"", ""kompleks karbonhidrat"", ""fırın""]",mercimekli-kinoali-dolgulu-renkli-biber-f6b709,446,66.00,10.50,22.00
